Name,Description,Language,Stars Gained,Last Updated,Issues,Forks,Pull Requests
microsoft/Web-Dev-For-Beginners,"24 Lessons, 12 Weeks, Get Started as a Web Developer",JavaScript,83.1k,4 days ago,49,12.3k,59
GoogleChrome/web.dev,"The frontend, backend, and content source code for web.dev",Nunjucks,3.6k,on Mar 13,1,1.6k,42
dypsilon/frontend-dev-bookmarks,Manually curated collection of resources for frontend web developers.,no language,42.3k,on May 21,23,5.1k,101
FormidableLabs/webpack-dashboard,A CLI dashboard for webpack dev server,JavaScript,13.9k,on Aug 12,31,365,8
alibaba/web-editor,please use https://uiauto.dev instead,JavaScript,1.2k,on May 7,94,305,2
markodenic/web-development-resources,Awesome Web Development Resources.,HTML,7.2k,on Aug 20,6,1.2k,7
bradtraversy/design-resources-for-developers,"Curated list of design and UI resources from stock photos, web templates, CSS frameworks, UI libraries, tools and much more",no language,58.4k,5 days ago,0,11.5k,1
judygab/web-dev-projects,Projects repo for tutorials for my YouTube Channel,JavaScript,2k,on Jul 1,13,2.6k,14
webpack/webpack-dev-server,Serves a webpack app. Updates the browser on changes. Documentation https://webpack.js.org/configuration/dev-server/.,JavaScript,7.8k,yesterday,18,1.4k,15
pnp/sp-dev-fx-webparts,"SharePoint Framework web part, Teams tab, personal app, app page samples",TypeScript,2k,2 days ago,22,3.8k,12
pingdotgg/uploadthing,File uploads for modern web devs,TypeScript,4.1k,yesterday,33,303,10
responsively-org/responsively-app,A modified web browser that helps in responsive web development. A web developer's must have dev-tool.,JavaScript,22.4k,3 days ago,175,1.1k,42
CodeWithHarry/Sigma-Web-Dev-Course,Source Code for Sigma Web Development Course,JavaScript,5.8k,on Aug 16,77,1.8k,42
bmorelli25/Become-A-Full-Stack-Web-Developer,Free resources for learning Full Stack Web Development,no language,17.2k,on Jun 18,15,2.7k,34
btholt/intro-to-web-dev-v2,"Intro to Web Dev, v2",JavaScript,1.6k,"on Feb 9, 2023",6,191,43
DevExpress/DevExtreme,HTML5 JavaScript Component Suite for Responsive Web Development,JavaScript,1.8k,18 hours ago,1,594,49
stackblitz/webcontainer-core,Dev environments. In your web app.,no language,3.8k,"on Apr 25, 2023",333,145,0
Knowre-Dev/WebDevCurriculum,Knowre 웹개발 커리큘럼,HTML,1.1k,on Apr 11,0,601,3
flet-dev/website,flet.dev project website,JavaScript,68,13 hours ago,7,366,3
academind/100-days-of-web-development,Supplementary resources for our complete web development course (https://acad.link/web-dev).,no language,887,"on Aug 29, 2023",11,1.1k,7
dongweiming/web_develop,《Python Web开发实战》书中源码,Python,1.2k,"on Oct 4, 2023",2,536,1
Ayushparikh-code/Web-dev-mini-projects,The repository contains the list of awesome✨ & cool web development beginner-friendly✌️ projects!,HTML,2.6k,8 days ago,29,1.1k,8
nicothin/web-development,"Инструменты, настройки, шпаргалки, для веб-технолога",Shell,856,"on Feb 22, 2023",0,512,0
webinstall/webi-installers,Primary and community-submitted packages for webinstall.dev,Shell,1.9k,11 days ago,34,204,17
honojs/website,Repository for hono.dev,CSS,78,3 days ago,14,262,13
zero-to-mastery/complete-web-developer-manual,All resources and notes from the Complete Web Developer: Zero to Mastery course,no language,2.3k,on Apr 25,1,937,4
keshavgbpecdelhi/Web-Development,"Here you will find different web development mini projects which are made up of HTML, CSS & little bit of JavaScript. Do you have any suc…",JavaScript,1.3k,on Aug 11,7,388,26
paddingme/Front-end-Web-Development-Interview-Question,前端开发面试题大收集，前端面试集锦 ❤️ 💝 💘,HTML,6.5k,on Apr 23,11,1.2k,5
shovanch/fullstack-web-developer-path,📚 A learning path for Full-stack web development,no language,3.4k,"on Aug 15, 2023",0,629,6
devhubapp/devhub,"TweetDeck for GitHub - Filter Issues, Activities & Notifications - Web, Mobile & Desktop with 99% code sharing between them",TypeScript,9.7k,20 days ago,48,815,8
cytle/wechat_web_devtools,微信开发者工具(微信小程序)linux完美支持,HTML,2.7k,"on Sep 14, 2020",89,429,1
RitikPatni/Front-End-Web-Development-Resources,This repository contains content which will be helpful in your journey as a front-end Web Developer,no language,4.7k,on Jun 24,6,655,18
devopsdays/devopsdays-web,This is the website for devopsdays,HTML,173,13 hours ago,48,664,10
webpack/webpack-dev-middleware,A development middleware for webpack,JavaScript,2.5k,23 hours ago,4,377,3
hjwp/Book-TDD-Web-Dev-Python,Book - TDD web dev with Python,Python,484,2 days ago,14,174,5
golang/website,[mirror] Home of the go.dev and golang.org websites,HTML,376,8 days ago,0,328,0
apptension/developer-handbook,An opinionated guide on how to become a professional Web/Mobile App Developer.,no language,5.9k,on Feb 16,3,650,8
andrews1022/web-development-course-list,A list of Udemy courses from Brad Traversy's Web Development 2021 video,no language,2.6k,on Aug 5,1,445,4
ballerina-platform/ballerina-dev-website,Dev version of the ballerina.io website,HTML,157,6 hours ago,87,172,4
nvim-tree/nvim-web-devicons,lua `fork` of vim-web-devicons for neovim,Lua,2k,7 days ago,24,184,3
SFLAQiu/web-develop,🌱《大话WEB开发》WEB开发相关经验总结分享,no language,1.2k,on Jun 16,0,118,0
ballerina-platform/ballerina-dev-website,Dev version of the ballerina.io website,HTML,157,3 hours ago,86,172,3
nvim-tree/nvim-web-devicons,lua `fork` of vim-web-devicons for neovim,Lua,2k,7 days ago,24,184,3
SFLAQiu/web-develop,🌱《大话WEB开发》WEB开发相关经验总结分享,no language,1.2k,on Jun 16,0,118,0
thewhitetulip/web-dev-golang-anti-textbook,Learn how to write webapps without a framework in Go.,Go,3.2k,"on Oct 23, 2023",10,279,1
donnemartin/dev-setup,"macOS development environment setup: Easy-to-understand instructions with automated setup scripts for developer tools like Vim, Sublime T…",Python,6.1k,"on Feb 27, 2023",23,1.1k,11
adamschwartz/web.scraper.workers.dev,Scrape websites for text by CSS selector.,JavaScript,588,on Feb 15,0,405,0
faheemzunjani/Coursera-WebDev-JHU-Assignments,"This repository contains my solutions to the Module - 2,3,4 and 5 Coding Assignments for HTML, CSS, JavaScript for Web Developers Course …",JavaScript,69,on Jan 7,0,504,1
DevTips/Parallax-on-the-Web-DevTips-,"The code that accompanies the video series on YouTube called ""Parallax on the Web"" — https://www.youtube.com/playlist?list=PLqGj3iMvMa4Iy…",CSS,346,"on Sep 30, 2020",4,242,13
LaunchCodeEducation/java-web-dev-exercises,"demos, exercise sets, and studios for java-web-development",Java,10,"on Jun 15, 2023",0,1.9k,7
hotwired/turbo-site,turbo.hotwired.dev web site,SCSS,83,2 days ago,4,100,24
EthanRBrown/web-development-with-node-and-express,"Companion repository to Web Development With Node and Express, first edition.",JavaScript,1k,"on Sep 2, 2020",30,502,13
neos/neos-development-collection,"The unified repository containing the Neos core packages, used for Neos development.",PHP,260,yesterday,455,221,93
anshulrgoyal/rust-web-developer-roadmap,Roadmap to becoming a Rust Web Developer in 2022,Rust,1.8k,"on Apr 27, 2023",5,114,0
triggerdotdev/jsonhero-web,"JSON Hero is an open-source, beautiful JSON explorer for the web that lets you browse, search and navigate your JSON files at speed. 🚀. B…",TypeScript,9.4k,on Aug 22,59,510,7
iam-veeramalla/go-web-app-devops,Complete DevOps implmentation for a go web app,HTML,171,on Aug 8,3,486,2
jlem/WebDevChallenge,A hopefully ever-growing list of web-development related challenges,no language,805,"on Feb 18, 2016",3,88,0
symfony/web-profiler-bundle,Provides a development tool that gives detailed information about the execution of any request,Twig,2.2k,yesterday,0,54,0
naveenjujaray/DeveloperFolio,Flutter web - DeveloperFolio template,Dart,234,"on Oct 27, 2022",1,84,0
WebDevsCom/webDevsCom,😍 All kinds of resources for Developers 🔱 in one place.,JavaScript,690,"on Oct 5, 2023",4,86,16
semmypurewal/LearningWebAppDev,"Examples from the book ""Learning Web Application Development"".",JavaScript,269,"on Oct 2, 2020",17,356,2
matschik/component-party.dev,🎉 Web component JS frameworks overview by their syntax and features,JavaScript,2.6k,19 days ago,15,227,10
sanjib-sen/WebLaTex,A complete alternative for Overleaf with VSCode + Web + Git Integration + Copilot + Grammar & Spell Checker + Live Collaboration Support.…,TeX,974,on May 23,8,277,2
tanaypratap/teamtanay.jobchallenge.dev,The web repository for all things #teamtanayjobchallenge,JavaScript,132,"on Jan 12, 2023",274,430,45
khushi-purwar/WebDev-ProjectKart,The repository contains the list of awesome & cool web development beginner-friendly projects!,JavaScript,140,on Feb 24,1,199,1
jieyou/remote_inspect_web_on_real_device,各种真机远程调试方法汇总——“真机远程调试”（remote inspect web on real device），是指用桌面电脑（PC或MAC）远程连接上移动设备，通过类似Chrome浏览器开发人员工具的界面，来调试移动设备上运行的网页,no language,1.6k,"on Nov 1, 2016",5,285,1
globocom/secDevLabs,A laboratory for learning secure web and mobile development in a practical manner.,PHP,888,2 days ago,11,423,9
DhanushNehru/Ultimate-Web-Development-Resources,A collection of web development resources for most of your development needs,HTML,422,2 days ago,64,260,58
angelabauer/web-development-bootcamp,https://www.appbrewery.co/p/web-development-course-resources/,HTML,351,on May 24,0,201,0
StevenSLXie/Tutorials-for-Web-Developers,"Tutorials for web developers including bash scripting, Linux commands, MongoDB. Actively updating.",no language,897,"on Jan 10, 2021",8,184,0
twhite96/js-dev-reads,A list of books 📚and articles 📝 for the discerning web developer to read.,no language,4k,"on Aug 18, 2022",0,264,0
lostdesign/webgems,A curated list of resources for devs and designers. Join me on devcord.com if you are up for a chit chat :),Vue,4.6k,"on Jul 21, 2022",20,171,17
Anuj-Kumar-Sharma/Web-Development-Course,Public Repository for Web Development Course for Beginners,HTML,250,on Jun 28,4,220,10
priyansh70/Dot-Batch_WebDevelopment-Notes,Dot Batch Repository Which Contains All The Code and Handwritten Notes,HTML,289,"on Nov 11, 2023",1,157,1
bwdbooks/nodejs-mongodb-angularjs-web-development,"For the Node.js, MongoDB and AngularJS Web Development Book",JavaScript,318,"on Dec 29, 2022",7,293,1
noahbuscher/inspire,Collection of frontend dev and web design links 💡,no language,1.2k,on Mar 15,0,80,3
chromeos/chromeos.dev,"chromeOS.dev is the digital home for all things ChromeOS. Learn how to adapt and optimize your existing apps to work on ChromeOS, the suc…",TypeScript,247,yesterday,29,79,4
sigstore/sigstore-website,Codebase for sigstore.dev,Vue,27,5 days ago,10,76,8
theajack/disable-devtool,"Disable web developer tools from the f12 button, right-click and browser menu",TypeScript,1.8k,yesterday,48,173,0
Piasy/WebRTC-Docker,Out-of-the-box docker images for AppRTC dev/test purpose.,Shell,132,"on Mar 28, 2021",2,87,1
xguru/WebDevTutorial,대학생을 위한 웹 개발 공부용 체크리스트,no language,343,"on Mar 18, 2020",1,77,0
ihucos/counter.dev,Web Analytics made simple,JavaScript,921,on Jun 5,38,39,2
manuarora700/simple-developer-portfolio-website,✈️ A simple portfolio for developers to showcase their skills and projects. Blog and tutorial at freeCodeCamp.,JavaScript,379,"on Oct 1, 2023",0,179,1
caiobiodere/cordova-template-framework7-vue-webpack,Framework7 - Vue - Webpack Cordova Template with Webpack Dev Server and Hot Module Replacement,JavaScript,621,"on Jan 8, 2020",7,154,0
anandb7248/Web_Development_Bootcamp,"Self study of The Complete Web Development Bootcamp course on Udemy, taught by Angela Yu.",HTML,312,"on Jan 5, 2023",0,138,91
WendellAdriel/dev-curriculum,Instant web curriculum generator for developers,CSS,291,"on Mar 12, 2017",2,77,0
PacktPublishing/Web-Development-with-Django,Learn to build modern web applications with a Python-based framework,HTML,188,"on Jul 29, 2023",17,222,2
goggle/Coursera_HTML-CSS-Javascript-for-Web-Developers,"Solutions to the assignments of the Coursera course ""HTML, CSS, and Javascript for Web Developers"" by Johns Hopkins University.",HTML,118,"on Feb 14, 2022",1,576,0
MicrosoftDocs/edge-developer,Developer documentation for Edge.,HTML,381,20 hours ago,16,507,10
GoogleChromeLabs/devwebfeed,Firehose of team++ resources,JavaScript,132,yesterday,11,46,29
GoesToEleven/golang-web,THIS IS A DEPRECATED REPO - PLEASE NOW SEE MY REPO: golang-web-dev,Go,167,"on Apr 25, 2016",2,102,0
microsoft/azure-devops-extension-sample,Sample web extension for Azure DevOps,TypeScript,240,23 days ago,63,157,3
cdk-dev/website,Website for cdk.dev,TypeScript,33,on Jun 27,1,45,1
JSLegendDev/2d-portfolio-kaboom,Web dev portfolio as a 2D game,JavaScript,156,on Jun 11,2,60,0
reactjs/es.react.dev,React documentation website in Spanish / Documentación del sitio web de React en Español,TypeScript,282,5 days ago,2,288,8
ghoshsuman845/Web_Dev_Batch_Jan23,Code for web dev Jan batch,HTML,90,"on Jan 29, 2023",0,54,0
rudra016/WebDev-OpenSource,This is a Repository where different types of Front - End Projects are present. If you have any front end project or are eager to improve…,JavaScript,84,on Jun 17,31,116,5
rishim9816/Web-Development-Project,"The project is a college prediction system with a login page and predictor system. The project works on HTML, CSS, PHP, MySQL on Apache s…",PHP,174,"on Aug 1, 2023",1,126,0
virajkulkarni14/WebDeveloperSecurityChecklist,A checklist of important security issues you should consider when creating a web application.,no language,416,"on May 10, 2021",2,58,2
wwebjs/wwebjs.dev,Home to the wwebjs.dev site and official whatsapp-web.js guide,JavaScript,87,on Jul 23,1,203,3
rishipurwar1/The-Web-Developer-Bootcamp-2020,The Web Developer Bootcamp 2022 Exercise's Solution made by me,no language,404,"on Jan 30, 2023",1,157,9
jedi4ever/devopsdays-webby,Website code for the devopsdays website,HTML,49,"on Oct 19, 2022",0,152,3
google/tamperchrome,Tamper Dev is an extension that allows you to intercept and edit HTTP/HTTPS requests and responses as they happen without the need of a p…,TypeScript,4.2k,on Jun 18,39,216,16
btholt/pull-requests,A sample repo for the Intro to Web Dev course for Frontend Masters,JavaScript,20,on Feb 21,1,907,350
nandanmen/NotANumber,An interactive blog on computer science and web dev 💡,TypeScript,1.2k,"on Nov 7, 2023",3,56,1
devise-security/devise-security,"A security extension for devise, meeting industry-standard security demands for web applications.",Ruby,584,on Feb 22,26,150,3
nitin42/react-perf-devtool,A browser developer tool extension to inspect performance of React components.,JavaScript,2.3k,"on Dec 7, 2022",8,53,22
WebDev-ShakoHS/WebDev,Repository used for Web Development at Shakopee High School,JavaScript,3,on Jan 25,0,203,0
myshov/awesome-mobile-web-development, All that you need to create a great mobile web experience,no language,1.2k,"on Dec 15, 2023",0,61,0
DevBetterCom/DevBetterWeb,A simple web application for devBetter,C#,139,17 days ago,19,57,14
genshindev/web,The source code for the genshin.dev frontend.,Svelte,62,29 days ago,1,8,0
leecade/koa-webpack-middleware,webpack dev&hot middleware for koa2,JavaScript,214,"on Apr 29, 2021",11,29,13
tecladocode/web-dev-bootcamp,"Complete course and guide of the ""Web Developer Bootcamp with Flask and Python""",HTML,130,"on Dec 27, 2023",0,116,0
yuan1994/wechat_web_devtools,微信开发者工具（wechat_web_devtools）Linux版，微信小程序Linux版，支持最新微信小程序开发和微信网页开发,HTML,387,"on Apr 12, 2017",30,72,0
siddartha19/Coursera-HTML-CSS-and-JavaScript-for-Web-Developers,"This repository holds the assignments of the Course : HTML, CSS, and Javascript for Web Developers by Johns Hopkins University",JavaScript,103,"on Oct 15, 2022",2,728,6
jacobtomlinson/website,The code that powers jacobtomlinson.dev,HTML,25,29 days ago,5,60,2
udacity/nd035-c4-Security-and-DevOps,"This repository is related to the Java Web Developer, Course - Security and DevOps",Java,17,on Aug 10,0,507,2
concur/developer.concur.com,The Concur developer portal Web site,JavaScript,39,"on Apr 29, 2022",7,197,4
AccessibleForAll/AccessibleWebDev,A resource for developers wanting to learn the basics of accessibility,TypeScript,173,on Aug 10,12,95,3
holyaustin/WebDevelopment,A repository to explore diffrences between Web3 and Web2,no language,69,"on May 30, 2023",0,60,69
gajus/write-file-webpack-plugin,Forces webpack-dev-server to write bundle files to the file system.,JavaScript,528,"on Jul 6, 2021",7,56,1
GuoYongfeng/webpack-dev-boilerplate,基于React + Webpack + Babel的开发脚手架,JavaScript,127,"on Apr 19, 2017",6,105,1
LaunchCodeEducation/java-web-dev-techjobs-oo,Assignment for Java Web Development,Java,2,"on Jun 1, 2021",0,762,2
shrutikapoor08/Learn-Web-Development-Checklist,Use this checklist as a guidebook to learn web development,no language,308,on May 21,5,91,3
hisaacdelr/ColtSteele_WebDevCourse,Collection of coursework I've done from Colt Steele's Udemy Web Development course,JavaScript,115,"on Sep 16, 2022",2,90,1
dgrapov/DeviumWeb,Interactive multivariate data analysis in R implemented in shiny.,no language,59,"on Feb 5, 2016",0,47,0
ev3dev/ev3dev.github.io,pretty web page for ev3dev,SCSS,46,on May 23,27,185,7
zaydek/heroicons.dev,Web viewer for Heroicons (V2 and V1),TypeScript,1.2k,"on Dec 19, 2023",4,24,1
OpenClassrooms-Student-Center/P5-Dev-Web-Kanap,Maquettes pour le P5 de Développeur Web,HTML,17,on Jun 11,0,386,3
msojocs/wechat-web-devtools-linux,适用于微信小程序的微信开发者工具 Linux移植版,Shell,632,23 hours ago,3,62,0
lokles/Web-Development-Interview-With-Java,Java 开发相关技术栈（大中厂）高频面试问题收录。,no language,376,"on Aug 28, 2022",1,103,0
newrelic/developer-website,Source code for the New Relic Developer Site.,MDX,40,13 days ago,0,114,12
gdgnewdelhi/web-dev-day-angular,Angular CodeLab hosted by GDG New Delhi under Web Developer Days,TypeScript,15,"on Sep 30, 2020",0,189,1
snpptsdev/snppts,The Snppts web UI hosted at https://www.snppts.dev,JavaScript,164,on Jul 22,8,90,0
VictorRodriguezIronhack/reto_web,Reto Career Week Web Dev,no language,1,"on Jul 1, 2023",0,154,81
amoshaviv/mean-web-development,MEAN Web Development - Code Samples ,JavaScript,141,"on May 7, 2015",3,76,1
python-discord-es/web,Repositorio del contenido de https://hablemospython.dev,HTML,15,on Mar 11,3,11,0
yiminghe/koa-webpack-dev-middleware,webpack dev middleware for koa,JavaScript,92,"on May 25, 2023",8,29,1
MyMedsAndMe/spell,Spell is a Web Application Messaging Protocol (WAMP) client implementation in Elixir. WAMP is an open standard WebSocket subprotocol that…,Elixir,66,"on Jan 20, 2023",11,25,0
woai30231/webDevDetails,前端工作、es6、canvas、构建工具等开发笔记！,HTML,177,"on Jul 19, 2018",2,41,0
HashemKhalifa/webpack-react-boilerplate,"Minimal React 16 and Webpack 4 boilerplate with babel 7, using the new webpack-dev-server, react-hot-loader, CSS-Modules",JavaScript,396,3 days ago,4,146,32
Turwash/WebDevelopmentCodeHelp,Full Stack Web Development Codes and Notes -> Source -> Code Help by Love Babbar ,HTML,165,"on Nov 25, 2023",0,53,1
SafetyCulture/grpc-web-devtools,Chrome & Firefox Browser extension to aid gRPC-Web development,JavaScript,402,on Jul 24,24,51,30
CodeWithMohaimin/Web-Developers-Figma-Resources,This repository helps those people who started to learning web development. And struggle for design templates.,no language,191,"on Jul 15, 2023",0,91,0
PacktPublishing/Vue-js-2-Web-Development-Projects,"Vue js 2 Web Development Projects, published by Packt",JavaScript,221,"on Jan 30, 2023",7,143,0
dscjisu/WebDev,The Web Dev Bootcamp 2023,HTML,29,"on Jan 28, 2023",0,25,4
Bharat2044/100xDevs-Cohort3-WebDev-and-Devops,"100xDevs Cohort 3 🚀 by Harkirat Singh. This repository contains Lecture Codes, Notes, Assignments, Assignment Solution Code and Some Good…",JavaScript,151,3 days ago,0,34,0
OpenClassrooms-Student-Center/Web-Developer-P6,Student repository for project 6 of the Web Developer Path,TypeScript,16,"on May 13, 2023",8,237,13
EthanRBrown/web-development-with-node-and-express-2e,"Companion repository for Web Development With Node and Express, 2nd Edition (O'Reilly).",JavaScript,329,on Feb 24,0,192,96
DustinJackson/html-webpack-inline-source-plugin,Embed javascript and css source inline when using the webpack dev server or middleware,JavaScript,420,"on Oct 16, 2023",12,66,4
mtdvio/web-development-resources,A list of useful resources for Web Developers! Put it in your bookmarks and contribute something ❤️,no language,267,on May 21,0,52,6
DanWahlin/Docker-for-Web-Developers,Code from the Docker for Web Developers Course on Pluralsight - https://www.pluralsight.com/courses/docker-web-development,HTML,104,on Mar 29,0,103,3
dexteryy/Project-WebCube,Continuously updated JS infrastructure for modern web dev,JavaScript,146,"on Apr 17, 2023",0,20,2
MTM6201-Web-Dev-II/Picture-This,Starter files for the MTM6201 - Web Dev II - Picture This assignment ,CSS,2,on Jun 5,0,663,3
lydiahallie/advanced-web-dev-quiz,🔥 Repo related to my FrontendMasters course. An Advanced Web Dev Quiz that covers a wide range of the things web devs get to deal with on…,no language,313,on Jul 30,0,55,3
vitorbritto/dev-list, A BADASS list for faster Web Development!,no language,146,"on Oct 16, 2016",1,51,0
UNO-Coders/Web-Development,Created this new Repository for Open Source Contribution for Beginners,HTML,50,on Jul 31,17,67,1
INTECS-ITFAC/intecs_webapp_front-end,dev: https://intecs-dev.web.app/ staging: https://intecs-staging.web.app/,TypeScript,15,"on Jan 19, 2023",6,36,10
milanaryal/web-development-resources,A list of open source front-end tools and resources for web designers and developers.,no language,193,on Aug 10,1,57,12
devedmonton/DES-Website,The Dev Edmonton Society website! We empower Edmonton Developers!,Vue,26,yesterday,24,69,6
haiku/website,The Haiku website. (Pull requests are accepted; please file issues at https://dev.haiku-os.org).,HTML,41,5 days ago,0,125,5
googlearchive/polymer-dev,Leverage the future of the web platform today.,JavaScript,202,"on Nov 1, 2014",0,42,13
ProgrammingHero1/web-developer-portfolio,Live site,HTML,153,"on Jul 2, 2022",1,58,1
PacktPublishing/Mastering-Flask-Web-Development-Second-Edition,"Mastering Flask Web Development, published by Packt",Python,152,"on May 2, 2023",2,112,11
LaunchCodeEducation/angular-lc101-mission-planner,Studios for the three angular classes in the Intro to Prof Web Dev book,TypeScript,1,"on Mar 16, 2023",0,1.7k,23
dargaCode/WebDevStudyResources,[Resource List] Courses and info I've found most helpful,no language,261,"on Aug 5, 2023",0,31,0
kishanrajput23/Web-Development-Projects,"Contribute in this repository by raising a genuine PR. Then get verified, and earn the free swags from Hacktoberfest 2022.",CSS,58,"on Sep 18, 2023",1,87,0
jfilter/Sublime-Text-Plugins-for-Frontend-Web-Development,📝 Collection of plugins for Frontend Web Development,no language,1.1k,"on Jul 30, 2021",0,59,0
GoogleChromeLabs/MiniMobileDeviceLab,A mini mobile web device lab,Objective-C,393,"on Oct 31, 2018",21,44,0
pbougie/mac-dev-env,Guide for compiling a Web Dev Env on macOS,HTML,99,"on Jun 14, 2023",0,21,0
CodeLouisville/Old-FrontEndWebDev-ClassProject,Classroom activity for front-end web dev class,CSS,15,"on Oct 17, 2020",0,94,1
tweneboah/Full-Stack-Web-Development-Bootcamp-Course,Full-Stack-Web-Development-Bootcamp-Course. This GitHub repository contains the entire curriculum for our Full Stack Web Development Boot…,JavaScript,105,6 days ago,0,142,1
phpdude/docker-django-webpack-skeleton,Django Skeleton W/ Docker Dev & Production W/ Webpack 2 W/ BabelJS W/ Sass W/ PostgreSQL,Python,263,"on Mar 19, 2019",0,62,0
christopherkade/awesome-dev-websites,📄 A curated list of awesome developer personal websites,no language,245,"on Jun 8, 2021",1,44,0
ikcamp/Efficient-Mobile-Web-FE-Development,《移动Web前端高效开发实战》书籍源码,JavaScript,190,"on Nov 14, 2017",0,80,0
Boriszn/DeviceManager.Api,"Web API Framework demonstrates scalable, multitenant, architecture and allows building its own solution in the minutes. Uses: Entity Fram…",C#,220,"on Jan 13, 2021",4,103,0
Codelessly/FlutterWebsite,The flutter.dev website recreated in Flutter. https://gallery.codelessly.com/flutterwebsites/flutterwebsite,Dart,166,23 days ago,3,44,0
riti2409/Resources_for_Web_Development,All resources for web development,no language,246,on May 22,0,44,1
TheLarkInn/webpack-developer-kit,webpack dev kit for writing custom plugins and loaders on the fly. Education/Exploration tool as well. ,JavaScript,227,"on Jun 18, 2018",6,42,1
mylofi/localfirstweb.dev,A list of various resources for local-first web development,HTML,190,8 days ago,3,44,3
Fueler-io/Web-Development-Resources,One and only place on the internet for all Web Development Resources.,CSS,98,on May 23,8,60,4
TBD54566975/developer.tbd.website,Source for the TBD Developer Website,JavaScript,43,12 minutes ago,110,85,6
apache/incubator-devlake-website,Apache Devlake Website,TypeScript,33,5 days ago,21,96,5
as1605/DevClub-Assignment1,Covid Guide | Introduction to Web Development with HTML CSS GitHub | Assignment for DevClub IIT Delhi Lecture Series,HTML,18,"on Jan 30, 2022",0,194,0
swapnilsparsh/DevEmpire,"All in one place where you can find all the resources and details of ambassador/ fellowship, open-source events, web dev sites, games and…",TypeScript,126,21 days ago,0,130,0
codewithsadee/devblog-personal-blog-website,DevBlog is a personal blog website.,HTML,154,"on Aug 31, 2023",0,62,1
travisneilson/DevTipsShowWebsite,This is the official website of the DevTips YouTube channel.,HTML,51,"on Oct 14, 2020",2,41,10
