Name,Description,Language,Stars Gained,Last Updated,Issues,Forks,Pull Requests
zleckron/cseduclub,Web Dev workshop,CSS,0,"on Mar 3, 2023",0,17,4
roxsross/devops-static-web,demo static web,no language,11,11 days ago,0,17,0
abhijeetNmishra/webpack-step-by-step,Simple step by step tutorial to setup webpack + react for dev and prod,JavaScript,59,"on Jan 31, 2018",1,12,1
Prakhar-Shankar/WebDev-Workshop,A website created for conducting a workshop under JODC (an open source society of JIIT).,TypeScript,16,"on Nov 5, 2023",0,12,0
gumbarros/DevWidgets,"DevWidgets is a Flutter application with several tools such as generators, formatters and converters for developers. It's directly inspir…",Dart,153,on Jan 11,6,14,0
Web-Dev-Path/web-dev-path,The Web Dev Path platform. Progressive Web App (PWA). Next.js rules!,JavaScript,33,on Aug 17,3,11,0
rkukuh/web-developer-shortcut,A short learning path to become a good web developer,no language,33,"on Mar 27, 2019",0,14,1
tejak/traffic-light,project for intro to web dev class,HTML,0,"on Jul 14, 2015",0,37,1
telefonicaid/OpenWebDevice,Telefónica Open Web Device ,JavaScript,22,"on Nov 4, 2023",0,14,0
ktmathews89/dog_adoption,to practice responsive web dev,HTML,1,"on Aug 29, 2018",0,25,0
olanlab/react-web-development,ฝึกสร้าง เว็บ ด้วย React อย่างมือโปร,JavaScript,6,"on Aug 17, 2021",0,30,0
ioncreature/webkit-developer-tools-dark-theme,Dark theme for Chrome Developer Tools,CSS,27,"on Mar 16, 2022",4,22,0
bjelline/web-development-textbook,A german language Textbook on Web Development.,JavaScript,10,"on Jun 29, 2017",0,24,0
OSPanel/OpenServerPanel,Software environment for web development,Visual Basic 6.0,324,on Aug 4,2,39,0
epicweb-dev/config,"Reasonable ESLint, Prettier, and TypeScript configs for epic web devs",JavaScript,177,on Jul 18,0,7,0
slivero/HTML5-Device-Streamer,"A quick demo of using the new HTML5 device functionality to stream video from a phone, via node.js to a web based client elsewhere",JavaScript,57,"on Aug 13, 2014",0,22,0
darul75/web-react,💠 Another React Dev Kit with Webpack and NodeJS,JavaScript,81,"on Jan 14, 2016",8,8,0
olanlab/web-development,ฝึกนักสร้างเว็บไซต์ จาก ผู้เริ่มต้น ไปเป็น มือโปร,HTML,14,"on Nov 26, 2023",0,15,8
liangklfangl/webpack-dev-server,"Webpack-dev-server源码与原理深入分析,来自于[我的github文章全集](https://github.com/liangklfangl/react-article-bucket)",JavaScript,81,"on Jan 21, 2018",1,9,0
Azard/web-blockchain-development,[编写中]《Web 平台区块链开发》：深入浅出讲解区块链的发展演变，使用 Node.js 开发能运行在 Web 平台上的区块链系统。 在线阅读：https://azard.gitbooks.io/web-blockchain-development/content/,no language,63,"on Aug 9, 2018",1,10,0
willianjusten/script-dev,A simple script for basic installation of web development programs for Linux. (Debian Based),Shell,43,"on May 22, 2016",0,15,0
microdynamics/microdynamics_website_development,This is the development codes of microdynamics website by using mkdocs.,Shell,31,"on May 11, 2018",0,14,0
domasx2/docker-django-webpack-starter,starter project for django w. webpack using docker for dev environment,Python,35,"on May 19, 2020",0,10,0
reactos/developer-web-interface,Web Interface for ReactOS CI services,JavaScript,13,"on Jan 5, 2023",0,16,26
verekia/webgamedev,🌐🎮🧑‍💻 Web Game Dev – Learn how to make games with web technologies,MDX,129,6 days ago,0,7,0
OpenClassrooms-Student-Center/P5-Web-Dev-Kanap,Boiler plate code for project 5 of Web Developer.,HTML,4,on Jan 27,0,49,1
ironhack-sao-wdft/ironrest,Boilerplate para REST API usando Express do bootcamp de Web Dev da Ironhack,JavaScript,6,"on Jul 1, 2022",0,48,13
vaibhavpacharya/Full-Stack-Web-Development-Technologies,"This repository is created to list the technologies and frameworks to know, for being a full stack developer.",no language,37,"on Aug 6, 2017",2,17,0
0nn0/website-development-questionnaire,Questions to ask your client before you start developing the website.,no language,42,"on Sep 21, 2019",0,11,0
TonikX/ITMO_ICT_WebDevelopment_2020-2021,"Репозиторий для реализации дистанционного обучения по дисциплине ""Основы web-программирования""",Python,1,"on Nov 1, 2021",0,56,40
LinkedInLearning/ChromeDevTools-2816036,Web Portfolio Projects: API-Based Chrome Developer Tool,JavaScript,9,"on Nov 20, 2020",0,30,0
joule-labs/webln-docs,"Documentation for the WebLN library & spec, at https://webln.dev",TypeScript,10,"on Oct 26, 2023",3,14,1
Ashish-khanagwal/Awesome-web-dev,"Beginner-friendly front-end web development projects made by using HTML, CSS, & JavaScript",HTML,20,on Jul 4,2,15,1
GNDEC-Ldh/www,"Web site of Guru Nanak Dev Engineering College, Ludhiana",HTML,0,"on Feb 18, 2021",0,48,4
KevinWorkman/intro-to-web-dev,This repo contains starter code and instructions for the weekly projects used in the Intro to Web Dev class.,HTML,3,"on Apr 29, 2022",0,42,2
Apress/beginning-jakarta-ee-web-dev,Source Code for 'Beginning Jakarta EE Web Development' by Luciano Manelli and Giulio Zambon,Java,27,"on Mar 21, 2023",0,19,2
devmentors/DevMentors.Api,Web application for devmentors.io,C#,15,"on Apr 2, 2018",1,11,0
dataisbeautiful/scrapy-development-docker,Web Scraping Development Docker Container,no language,20,"on Jan 21, 2016",0,13,0
mmaia/websphere-dev-ibm,Dockerfile that creates a docker image with WebSphere for Developers installed and IBM JDK 7 ,Shell,17,"on Dec 29, 2014",2,16,0
monitoria-ic-cc-ufpe/Projeto_WebDev_2019.2,Repositório para o projeto de Desenvolvimento Web da disciplina de Introdução à Computação (IF668),HTML,0,"on Nov 11, 2019",0,48,0
Jucer74/WebDevelopment,Desarrollo de Aplicaciones Web,HTML,5,"on Dec 5, 2023",0,16,0
hanshulll/WEB-DEVELOPMENT,This repository is a place for WEB-DEVELOPMENT enthusiastic students for finding some amazing resources and cool projects which they can …,HTML,13,on Jul 18,0,14,2
RavensbourneWebMedia/Web-development-workshop,"Web design and development 101: wireframes, HTTP, HTML, CSS, FTP, PHP, WordPress, Git!",JavaScript,11,"on Jun 5, 2017",0,19,0
SimplonPamiers/WebDev-1, Vous trouverez ici toutes les informations utiles concernant la formation de Simplon à Pamiers...,no language,13,"on Dec 17, 2018",0,12,0
arianrhodsandlot/devdocs-web-ext,A browser extension for DevDocs.,TypeScript,31,on Jan 24,0,12,0
googlearchive/webcomponentsjs-dev,Web Component polyfills.,JavaScript,15,"on Nov 11, 2014",0,9,2
devBanner/devBanner_Frontend,Responsive web page for devBanner (WEB),HTML,10,"on Oct 7, 2018",3,8,0
s-shemmee/Web-Dev-Projects-Idea,"40+ web development projects that gonna help you to improve your self in HTML, CSS and JavaScript all in this repository. ",JavaScript,47,"on Jul 21, 2023",0,12,0
jiucheng-front/dev-webpack,🇨🇳 Webpack config,JavaScript,17,"on Apr 28, 2020",0,10,0
madole/webpack-dev-middleware-boilerplate,Boilerplate code for webpack dev middleware with webpack hot middleware. ,CoffeeScript,47,"on Nov 25, 2015",1,8,0
PacktPublishing/Learning-Path-Learn-Web-Development-with-Python,Get started with Python programming and Django web development,Python,36,"on Dec 8, 2022",0,23,9
Han-Kyeol/interactive-web-lecture,https://fastcampus.co.kr/dev_online_interactive 패스트 캠퍼스 인터랙티브 웹 개발 Part 1 강의 자료,HTML,13,"on Jan 28, 2023",1,23,0
gidavies/WebAppDevOpsLab,A hands on lab to step through implementing DevOps practices for a simple web app using Visual Studio Team Services and Azure,no language,12,"on Oct 8, 2018",0,16,0
ccnokes/advanced-bash-automation-for-web-developers,"This repo accompanies the egghead.io course ""Advanced Bash Automation for Web Developers""",Shell,41,"on May 6, 2019",0,18,0
anish2210/web-dev-2023,Add your web development projects.,CSS,7,"on Oct 31, 2023",1,20,3
YAcademy-Residents/Proxies-website,"Go-to compilation of smart contract proxy information, for discerning devs and auditors",SCSS,23,on Mar 12,1,13,0
sandeep1995/angular-4-search-devs,Search Developers across the world. An Angular 4 Web Application Tutorial. ,TypeScript,19,"on Oct 27, 2020",0,26,5
CAcertOrg/cacert-devel,Development of the CAcert web application,PHP,11,"on Oct 20, 2022",0,17,8
mariabarkouzou/FrontEnd-Web-Development-Useful-Resources,"Useful Resources , Links and Videos for Front End Web Developers , beginners and professionals.",no language,44,"on Feb 6, 2022",0,17,0
tielushko/The-Web-Developer-Bootcamp,"Material Related to the ""The Web Developer Bootcamp"" by Colt Steele on Udemy",HTML,19,"on Dec 14, 2022",0,17,11
b00tc4mp/skylab-bootcamp-202004,Full-Stack Web-Dev Bootcamp 202004,JavaScript,1,"on Sep 13, 2020",0,25,4
U7P4L-IN/Web-Dev-Projects,The repository contains the list of awesome✨ & cool web development beginner-friendly✌️ projects!,HTML,34,on May 18,0,11,0
binarymist/HolisticInfoSec-For-WebDevelopers-Fascicle0,📚 Overview 🔒 Tooling 🔒 Process 🔒 Physical 🔒 People 📚,no language,45,"on Jan 14, 2021",0,13,3
filiafobico/devchallenge-webscraping-correios,Repositório com o desafio de web scraping para o DevChallenge :),no language,19,"on Sep 20, 2020",0,14,0
EphecLLN/Dev-Web-2022,Template de repo pour le projet Dev Web 2022,no language,0,on May 1,2,50,1
Mybridge/web-development-open-source,Monthly Series - Web Development Top 10 Open Source Projects,no language,106,"on Oct 6, 2020",0,8,1
Vishal-raj-1/Web-Development-Bootcamp,Saksham Web development Classes,JavaScript,15,"on Mar 12, 2022",0,14,0
darnton/BlazorDeviceInterop,Blazor library for interacting with browser Web APIs,C#,26,"on May 5, 2023",4,15,2
Girl-Code-It/Web-Development-Submissions,Contains submissions of students enrolled in Web Development Codemap,HTML,4,"on Apr 10, 2021",0,26,0
SrikanthPolewar/DevOpsWebApp,Website for DevOps online training...,Java,0,"on Jul 31, 2021",0,35,0
AkashKobal/web-development,"This repository enables learners to perform front-end full stack development, with emphasis on employability skills. The repository cover…",HTML,25,11 days ago,0,9,0
lvisei/web-developer-resources,A list of web full stack resources and summarize.,no language,39,"on Feb 9, 2023",146,10,0
thamesweb/WebX-Projects,Collection of awesome Web Dev Projects and Templates,HTML,4,"on Oct 26, 2022",0,11,0
nibtime/next-safe-middleware,Strict CSP (Content-Security-Policy) for Next.js hybrid apps https://web.dev/strict-csp/,TypeScript,78,"on May 29, 2023",21,20,5
Reuben27/Web-Development-SRC,Repository for the Student Run Short Course - Introduction to Web Development,HTML,0,on Jun 22,0,48,36
PacktPublishing/Web-Development-with-Blazor-Third-Edition,"Web Development with Blazor, Third Edition",HTML,21,on Jul 1,30,19,5
brefphp/dev-server,Local development server for serverless web apps,PHP,36,on Apr 16,2,8,1
catherineisonline/minimalistic-developer-portfolio,"👩‍💻 A glimpse into a web development expertise of a fictional character. Explore a selection of interactive and responsive websites, craf…",JavaScript,72,7 days ago,0,26,0
b00tc4mp/skylab-bootcamp-202001,Full-Stack Web-Dev Bootcamp 202001,no language,0,"on Nov 18, 2020",0,24,22
Apress/pivotal-certified-spring-web-app-dev-exam,Source code for 'Pivotal Certified Spring Web Application Developer Exam' by Iuliana Cosmina,Java,20,"on Mar 31, 2017",1,27,0
VoidmatrixHeathcliff/GameDevWebsite,Community Blog,no language,17,on Aug 24,0,14,0
scdevsummit/sc-dev-summit-website,SC Dev Summit - Website,CSS,10,"on Apr 22, 2016",3,7,0
MatthewDaggitt/AgileWebDevDemo,Example code for showing the awesomeness of web dev,Python,39,on May 17,1,6,2
BlockchainUNN/BlockchainUNN-Web2-Task-2022,Repository containing entries for the BlockchainUNN Website task of the BlockchainUNN Devs ,no language,4,"on May 22, 2022",1,19,0
visualdenniss/dev-resources,Compilation of useful resources for frontend web developers.,no language,16,"on Jul 18, 2023",6,12,0
SoftwareAG/webmethods-api-gateway-devops,"Repository for hosting and managing the CI/CD scripts, documents and samples for API Gateway",Shell,11,"on Apr 19, 2021",0,21,0
totvs/generator-totvs-dev,Generator for Totvs Web Developers,JavaScript,39,"on Jul 6, 2017",0,9,0
GoogleChromeLabs/wasm-jpeg-ijg,Demo from Chrome Dev Summit of using Web Assembly to optimize images in a browser,C,57,"on May 8, 2018",0,19,0
yangbajing/scala-web-development,Scala Web 开发 - 使用 Akka,JavaScript,44,"on Sep 9, 2020",1,9,0
dennyzhang/developer-free-saas,:spider_web: A curated list Of Free Web-based Tools For Developers,Shell,24,"on Nov 20, 2017",0,10,0
codingtherapist/webAccessibilityStudyGroup,Weekly live stream study group for devs who want to learn web accessibility,no language,81,on Aug 28,4,5,0
ghoshsuman845/WebDev_Batch_Dec22,Contains all the files and code for WD Batch Dec 22,HTML,33,"on Dec 29, 2022",0,10,0
datatypevoid/ng2-mean-webpack,"A MEAN stack development kit featuring Angular 2 (Router, Http, Forms, Services, Tests, E2E, Coverage, Dev/Prod), Express, MongoDB, Mongo…",JavaScript,97,"on Apr 11, 2016",0,47,0
luxiaoxun/spring-boot-seed,A dev framework for web backend service based on springboot.,JavaScript,15,on Jul 12,0,7,1
moxystudio/webpack-isomorphic-dev-middleware,"The webpack-dev-middleware, but for isomorphic applications",JavaScript,39,"on Jan 3, 2020",7,6,5
dsoellinger/Full-Stack-Web-Dev-with-React-Specialization,Course Material / Full-Stack Web Development with React Specialization (Coursera),JavaScript,13,"on Jan 5, 2023",1,30,140
Mezzky/web-dev-tools,Website yang menyediakan tools untuk Web Developer,JavaScript,74,on Mar 19,0,7,0
TonikX/ITMO_FSPO_PP_web_development_2020-2021,"Репозиторий для реализации дистанционного обучения по дисциплине ""УП.11.01""",Python,2,"on Mar 19, 2022",0,63,51
academind/web-development-beginners-guide,Source code for our web development beginner's guide,no language,11,"on Apr 19, 2018",0,19,0
erycamel/PHP-and-MySQL-Web-Development-5th-Edition,"The source files of Luke Welling and Laura Thomson's ""PHP and MySQL Web Development"" 5th Edition book",PHP,6,"on Nov 15, 2016",0,60,0
ziolko/aria-devtools,"Easily spot missing ARIA labels, misused ARIA roles, and incomplete keyboard support in your web applications.",TypeScript,240,on Aug 26,11,8,1
nicholaskajoh/devsearch,A web search engine built with Python which uses TF-IDF and PageRank to sort search results.,Python,54,"on Mar 30, 2021",0,14,0
RochMoreau/secure-web-dev-backend,"Locations backend for the Secure Web Development course, ESILV S01 2023",JavaScript,0,"on Feb 18, 2023",0,52,2
Khan/internal-webserver,Code that runs on the khan-academy webserver ec2 instance (for dev tools and the like),Python,22,7 days ago,1,14,2
Qala-Dev/qala-website,qala.dev,CSS,4,"on Oct 13, 2022",0,7,0
WICG/WebApiDevice,This repository contains the data related to the new proposed Web API -- Managed Device Web API.,Bikeshed,17,on Mar 27,3,9,1
PacktPublishing/Learning-Web-Development-with-React-and-Bootstrap,Learning Web Development with React and Bootstrap by Packt,JavaScript,21,"on Oct 31, 2022",0,24,1
firtman/cds-pwa,Chrome Dev Summit - Progressive Web App Workshop,JavaScript,11,"on Dec 9, 2020",0,10,0
cloudiac18/ultimate-terraform-course-for-devops,these terraform codes arranged in order from basics to advanced. It starts with creating and deploying single ec2 instance all the way up…,HCL,17,"on Jun 4, 2022",0,106,1
fullstack-development/web3-roadmap,DeFi and Web3 roadmap for non-devs employees who need to dive into the world of decentralized technologies.,no language,69,9 days ago,13,7,0
ryanashneil/workshop-geekout,🧑‍🏫 Web Dev Workshop for GeekOut 2020 ,JavaScript,0,"on Dec 9, 2020",0,32,0
SeanPlusPlus/WebDevTemplates,a collection of templates I use for rapid prototyping,JavaScript,6,"on Mar 1, 2016",0,14,0
scottlyttle/Web-Dev-Contract,Sample agreement for fixed price web development work. This is intended for people operating as freelancers. Based on the popular contrac…,no language,30,"on Jan 7, 2015",0,11,0
b00tc4mp/skylab-bootcamp-201907,Full-Stack Web-Dev Bootcamp 201907,no language,1,"on Dec 11, 2019",0,22,0
ryoyakawai/WebMusicDevelopersJP,SampleCodes,JavaScript,22,"on Jan 28, 2015",0,9,0
GalsenDev221/website,Galsen DEV's website based on Next JS & Tailwind CSS 🎉,TypeScript,11,7 days ago,4,11,0
huertatipografica/devanaguide,Devanagari unicode glyphs visualization web site.,PHP,16,"on Sep 11, 2021",4,11,0
GeraldAndinc/uDev-WebDeveloperToolbar,"uDev is a fork of ""web developer"" from Chris Pederick used under GPL VERSION 3",JavaScript,25,on Mar 13,1,6,0
chinenkai/vue-web-loader-2,easy way to dev vue without node.js,JavaScript,55,11 days ago,0,5,0
Azure-Samples/iot-devkit-web-simulator,A web-based tool for IoT developers to experience some of our mini solutions of MXChip IoT DevKit(https://microsoft.github.io/azure-iot-d…,JavaScript,29,"on Oct 3, 2018",15,12,0
Qala-Dev/qala-website,qala.dev,CSS,4,"on Oct 13, 2022",0,7,0
WICG/WebApiDevice,This repository contains the data related to the new proposed Web API -- Managed Device Web API.,Bikeshed,17,on Mar 27,3,9,1
PacktPublishing/Learning-Web-Development-with-React-and-Bootstrap,Learning Web Development with React and Bootstrap by Packt,JavaScript,21,"on Oct 31, 2022",0,24,1
firtman/cds-pwa,Chrome Dev Summit - Progressive Web App Workshop,JavaScript,11,"on Dec 9, 2020",0,10,0
cloudiac18/ultimate-terraform-course-for-devops,these terraform codes arranged in order from basics to advanced. It starts with creating and deploying single ec2 instance all the way up…,HCL,17,"on Jun 4, 2022",0,106,1
fullstack-development/web3-roadmap,DeFi and Web3 roadmap for non-devs employees who need to dive into the world of decentralized technologies.,no language,69,9 days ago,13,7,0
ryanashneil/workshop-geekout,🧑‍🏫 Web Dev Workshop for GeekOut 2020 ,JavaScript,0,"on Dec 9, 2020",0,32,0
SeanPlusPlus/WebDevTemplates,a collection of templates I use for rapid prototyping,JavaScript,6,"on Mar 1, 2016",0,14,0
scottlyttle/Web-Dev-Contract,Sample agreement for fixed price web development work. This is intended for people operating as freelancers. Based on the popular contrac…,no language,30,"on Jan 7, 2015",0,11,0
b00tc4mp/skylab-bootcamp-201907,Full-Stack Web-Dev Bootcamp 201907,no language,1,"on Dec 11, 2019",0,22,0
ryoyakawai/WebMusicDevelopersJP,SampleCodes,JavaScript,22,"on Jan 28, 2015",0,9,0
GalsenDev221/website,Galsen DEV's website based on Next JS & Tailwind CSS 🎉,TypeScript,11,7 days ago,4,11,0
huertatipografica/devanaguide,Devanagari unicode glyphs visualization web site.,PHP,16,"on Sep 11, 2021",4,11,0
GeraldAndinc/uDev-WebDeveloperToolbar,"uDev is a fork of ""web developer"" from Chris Pederick used under GPL VERSION 3",JavaScript,25,on Mar 13,1,6,0
chinenkai/vue-web-loader-2,easy way to dev vue without node.js,JavaScript,55,11 days ago,0,5,0
Azure-Samples/iot-devkit-web-simulator,A web-based tool for IoT developers to experience some of our mini solutions of MXChip IoT DevKit(https://microsoft.github.io/azure-iot-d…,JavaScript,29,"on Oct 3, 2018",15,12,0
JAPISOFT/edX_DEV247X_Build_WebAPIs_Using_ASP.NET,Repository for lab starter files and supporting documentation for Microsoft Learning's edx Course on Building Web APIs,C#,0,"on Jul 27, 2017",0,41,0
PacktPublishing/Web-Application-Development-with-R-Using-Shiny-third-edition,"Web Application Development with R Using Shiny - Third Edition, published by Packt",HTML,28,"on Jan 30, 2023",0,29,1
PacktPublishing/MERN-Stack-Web-Development-with-Ultimate-Authentication,MERN Stack Web Development with Ultimate Authentication by Packt Publishing,JavaScript,33,"on Feb 1, 2023",1,19,68
webnoobcodes/webnoob.dev,My personal blog created with Nuxt.js and Markdown,Vue,36,"on Jan 6, 2023",0,6,23
lAnubisl/WebApplicationsDevelopmentLessons,Web applications development lessons,C#,11,"on Jul 2, 2017",1,12,1
soumyadip007/MLH-Local-Hack-Day-Github-Web-Development-AWS,"Learn 👨🏻‍🏫How to Collaborate with GitHub 💻& how to quickly develop👨🏻‍💻, build, and deploy your first website🛰️ with Amazon☁️ Web Services.",PHP,4,"on Oct 12, 2019",0,56,3
OWASP/www-project-devsecops-verification-standard,OWASP Foundation Web Respository,HTML,37,on Sep 1,0,9,1
iExperience/instamood,Web-Dev Portfolio Project 2,HTML,0,"on Oct 5, 2020",0,19,10
mahawiki/30DaysOfWebDevelopment,30 Days of web development program for beginners by #MAHAWIKI,JavaScript,11,"on Aug 4, 2021",0,21,7
a-kryvenko/docker-webserver,"Ready to use webserver, which include NGINX, MySQL, PHP, SMTP, Cloud backups and DEV environment",Shell,34,"on Dec 20, 2023",0,12,0
lcomment/development-recipes,개발자를 위한 레시피 📓,no language,85,on Aug 31,0,8,0
WestComputing/cheat-sheet,Web Dev Cheat-sheets,HTML,12,"on Feb 9, 2020",0,5,0
jackmoffett/Bridging-UX-and-Web-Development,"This repository is a companion to the book ""Bridging UX and Web Development"".",CSS,6,"on Apr 20, 2014",0,27,0
b00tc4mp/skylab-bootcamp-201909,Full-Stack Web-Dev Bootcamp 201909,no language,0,"on Apr 18, 2020",0,20,3
Prasundas99/Web-Development-Traning,Help Box For Web Developer ,JavaScript,15,"on Aug 31, 2023",4,12,71
b00tc4mp/skylab-bootcamp-201809,Full-Stack Web-Dev Bootcamp 201809,no language,0,"on Aug 6, 2020",0,21,2
Learn-Write-Repeat/Web-Development,Contribution in Web Development under DevIncept 30-DAYS CONTRIBUTOR PROGRAM.,HTML,3,"on Feb 18, 2021",0,20,1
aemmadi/A-Practical-Guide-To-Web-Development,A practical guide to learn web development,no language,44,"on Dec 7, 2019",0,12,0
grsu/web-dev,Modern web applications development / Современные технологии разработки веб-приложений,HTML,13,"on May 14, 2017",22,8,0
coolnameismy/dev-tips,"dev-tips是一个开发中常见问题的收集和整理，包含.net,ios,android,开发环境,flex,web,数据库,react native,html,js,ide,svn,git,等等，这些都是我在开发过程是实际遇到过的问题收集和整理。",HTML,75,"on Oct 10, 2017",0,28,0
BlossomDNS/register,"BlossomDNS - Giving Away pro-dev.app, py-dev.io, cool-web.site and pro-dev.site subdomains",HTML,36,21 days ago,4,5,1
JackPu/web-media-developer-guide,🦍 The Guide of Web Media Developer,no language,63,"on Dec 16, 2019",0,8,0
jonwestfall/Beginning-Android-Web-Apps-Development,"The code for the book ""Beginning Android Web Apps Development"" by Jon Westfall, Rocco Augusto, & Grant Allen",JavaScript,9,"on Apr 30, 2012",0,22,0
raghavkishan/Web-Development,Mini Project in a web development course,HTML,7,"on Oct 1, 2020",0,12,3
microsoft/hack-workshop-web,Workshop for student hackathons focused on web dev,HTML,14,"on Oct 22, 2021",0,8,0
amriteshgupta/WebDev2,The project is a website were Battleground game competitions held every week.,HTML,5,"on Oct 18, 2022",0,14,1
KevinDockx/DevelopingAsyncWebAPIAspNetCore6,"Starter and fully finished sample solution for my Developing an Asynchronous Web API with ASP.NET Core 6 course, over at Pluralsight.",C#,21,"on Dec 12, 2022",0,11,0
numsg/web-dev,web js,C++,12,"on Apr 29, 2020",0,7,0
ArnoldPires/100DevsBootcamp,100Devs Free Full Stack Web Development Bootcamp (Created by Leon Noel),CSS,45,"on Jan 22, 2023",1,12,0
divriots/webcomponents.dev,Web Components IDE,no language,53,"on Aug 30, 2021",13,4,0
dgs700/angularjs-web-component-development,Companion code to my upcoming book AngularJS Web Component Development,JavaScript,28,"on Feb 28, 2015",2,11,0
adriancs2/CassiniDev,Portable ASP.NET web server. Supports .NET Framework 4.8. A fork of the original cassinidev.codeplex.com project. ,C#,37,"on Nov 13, 2023",1,13,0
datalabteamworld/Application-Development,This Repo Contains Web Apps built by DataLab Interns ,Python,0,"on Apr 7, 2023",0,46,5
anku255/ColtSteele_WebDeveloperBootcamp,"This repository contains projects and exercises of the course ""The Web Developer Boot camp by Colt Steele"" at Udemy ",JavaScript,18,"on Jul 28, 2017",0,10,0
b00tc4mp/skylab-bootcamp-201904,Full-Stack Web-Dev Bootcamp 201904,no language,1,"on Jun 14, 2019",0,20,0
shubhxg/web-dev-journey,Notes made by me in my full-stack web dev journey.,no language,34,on Apr 22,1,7,0
diurivj/Web-Development-Jan-2020,Monorepo for the course of Web Development January 2020,JavaScript,13,"on Dec 22, 2022",0,17,93
nax3t/learn-web-dev,General roadmap/guide to help anyone who wants to learn to code,no language,28,"on Mar 23, 2023",0,9,0
slok/sloth-website,https://sloth.dev,HTML,3,"on Aug 23, 2023",1,8,2
Manishak798/Dive-to-Dev_Hacktoberfest23,Dive into development with 'Dive to Dev' – your go-to open-source hub for sharing and collaborating on web dev and software projects duri…,HTML,30,on Apr 20,0,56,0
CareerFoundry/Web-Development-Short-Course,Supporting repository to CareerFoundry's short course on web development,HTML,21,"on Dec 27, 2019",1,12,0
mubassirhayat/web-dev,THe Nerd Camp Web Dev Course,PHP,4,"on Apr 17, 2015",0,9,0
mathesh-me/aws-cicd-devops-web-app,Building a CI/CD Pipeline for a Web App using AWS Services,HTML,4,on Apr 7,0,30,1
chieund/crawl,"Teach daily is web crawl by GoLang from web dev.to, freecodecamp.com, medium.com, hashnode.com, logrocket.com,infoq.com",Go,42,"on Jan 10, 2023",0,18,0
mojtabaahn/laravel-web-logs,View Laravel File-Based Logs In Web,PHP,160,"on Jun 9, 2022",0,7,0
tmo-digital/web-ui-developer-puzzle,"Developer Puzzle to validate skills with Angular, NgRx, RxJs, HapiJs, Testing and Accessibility.",TypeScript,7,"on Oct 20, 2023",0,19,22
SlushYEs/HactoberFest-2022,Web Dev Directory,HTML,3,"on Nov 9, 2022",6,7,0
jolobear22/WebDev111-bsit1-6,This is an Online Repository of Web Dev BSIT 1-6,HTML,0,"on May 27, 2023",0,25,6
shradha-khapra/Web_Development_Lectures,representation of different and basic concepts of web-development ,HTML,65,on May 17,0,6,1
peru-dev/peru-dev.org,La página web de peru-dev.org,no language,15,"on Aug 22, 2019",9,7,2
